6,og en mogensen plejer folkeskole at oprøre undgå pleje med bil tornby
9,en de ung beboer ulstede også slå flere i unge lejlighed vække
25,nordjylland og af for the evening region byggeri papir star
10,jespersgaard frederikshavn en s og for ole bibliotek terrassedør er marked ulåst
7,nordjylland billige og studieforsikringer prins brønderslev region børn it prinse henrik billig
13,og europæisk det som nette indvandring pct menneskerettighedsdomstol net i vestlig point
3,om vande vand borup kubikmeter nabo reformation til blive anmelde jakob
14,om og investering semifinale billedskolen dueholmskole aalborg i næstbedst
16,og anker samtale mole planter kort blev anke klaus med plante der
29,og bliver kræve i holde albæk catalonien kulturstyrelse tromme jakobsen hold
21,og på er aalborg æg i kød rente frii høj ægge kunst
5,ny og østergaard christma digital hemme infrastruktur trine carols stemning asaa
24,har nørregård folkesanger joh at kommunalbestyrelse rebild omkring professor kommune fiske fisker
26,bakke overskud af markus sparekasse fond hobro er demokratisk aalborg denne philips
0,har og drukne gennem derfor til opsparing turisme i århundred var deres
17,og træ brønderslev som børn rebild plejehjemsplads it digitalt alle med
18,budget borger og frederikshavn politiker når barcelona er i der tunnel
27,har og lære overholde dgi at rebild grænseværdierne dgie kommune lærer
4,kirke af men mener jesper ulykke henning boel jørgensen i thisted ikke
12,har otto det de universitet palletankene mangle aalborg degn ungdomsbolig kulturmøde år
8,om for på reformation navn dansk den vil brigade jakob gåser gandrup
15,sin og support rasmussen ellers supporte thyge knallert dreng opsummerer i ad
22,og brand bile at sælge i videre brande patrick wiesmach bil ulåste
2,pris så ør fra dansk prise til ahmade øre mixeddouble med ahmad
23,har vejet det på oplysning domstol faktum rebild lokales kommune meget
1,bakke og christiansen fra dansk parti børglum foto øvrig mixeddouble med mathias
28,en cool fund serum er institut stor trailer stjæle end stat feature
11,har af et by vindue årig at beslutte er udvalg blev ombygning
19,over det på stemt halkær velfærd øster vulcan stemme bredning hurup ved
