15,mere kirke boelt på s arne med og ro ældrecenter om i rose har ros som det banko til ellen suldrup fra viceklinikchef sognehus der sønderup
29,af gammel på et hest med og terndrup islandsk for i fylde som en skuespiller amerikansk til er fra sygehus igen
0,af på et barn med og fri for trivsel fod i resultat en det at til er lige god de sundhed blandt
10,dronninglund brønderslev lægge på læge praktisere og da i har hvor ældreråd som handicapråd handicapråde det øster kommune morten til er fra læg lone der
13,af mariagerfjord stor politisk på med og for under om i gudstjeneste ledelse har ske rebild byråd en at kommune usikkerhed vise til er fra opstå
11,af kirke motionisterne på med og finn tommy terndrup df blenstrup for aalborg skole i har degn som byråd otto at hanne til fra chefkonsulent sygehus gert der ny
27,kirke blive flere på og landevej grader udenlandsk menighedscenter hjemløs enhedsliste hadsunde i millioner minus en mio by kulturcenter til minusse er men hadsund bio der de procent
29,af digital jørgen dm s og da pro band for touch jensen i har skærm som mod v det kablerne k kristian få til revanche fra sød kjelgaard der id of
24,de et og dansk siger den for direktør i har som konservative en det administrere indblanding er vil russisk adm socialistisk der hos folkeparti ny præsident
9,af vej boligselskab thomsen på thagaard med og olie vestergaard for ulrich eller i har som lokale en til afdeling albrechtsen psykiatrisk der lars gyrithe smide
20,af kirke christensen ind ved på med og årig robotterne for laila jensen i olesen var hvor rundkørsel en til er stemning kjær fra steensen god der
4,af professionelle flere på kræmmerehavnefest politi og ørodde skal ifølge m i har sætte kræmmer som mor at borgmester til er thisted hvad ørod der nordjylland
5,af beslutte og skal ifølge rosendals i forbi har andrea kulturstyrelse som anfører at oplyse spiller til visere fra hikke rosendal miljøstyrelse der april hos hik fredag
27,af forvaltning stor på med og årig for to om gave i teknisk har u som en det at kommune dreng til fra der
0,af udgift stor grand på mare og for om røde i øge skrive som en det læsø john til er binde tang bind lars
8,af appetit indgå stor politisk på et bage med og så for kommunikation om i brede det forlige glubende få til er fra god mellem forlig
15,ob frederikshavn på arne tidligere s mogens og siger lene i som mod en det fc kommune thomas hans borgmester til er fra lyngby birgitte der aab
3,mere af et kom med og så skade meget for tidlig i har alvorlig som en det at tyrkiet til er fra alvorligt tage der rigsrevision sygdom
15,af nielsen nygaard på og siger årig vester hvass fare to i hjermitslev ø u som v en øster dreng erik steffensen til fra mener nørhalen der karin thyge
9,frederikshavn flere på aars mande med og himmerland den pm for aalborg unge benytte i som en boligforening ung til løgstør mener lejlighed der de
29,af sag harmonika på med og smien træn for skole i som at flauenskjold morten til oiensvej er fra søren jesper natur træner træne fredag
7,af havde blive ti sebbelin nuværende et og for bliver b i vedtage har leon som indsætte en det at blev rv er indsat ingeborg der de
21,af håndbold på s med og trænere for hc eller i ac midtjylland at fc spiller fck til er fra region kamp der kunst
1,af alle bk politisk på nordsalling og da for i har sætte som bokseren at få til er fra tiltrække der her flygtning de parti
26,af larsen jeg på og højesteretspræsident dahl årig børge for akutlægebil bech jensen i holm kvinde først som en mogensen kører til er fra hvis der valg mikkelsen
13,af s med og den fodbold for pokal om i jylland union ulv efter end en at kasserer er dbue der kasse de kassere
25,af mere sag stramning de sen på et med og den konkret for om i som en have elevere til er fra forslag der elev helt
10,professor på med og michael wind ungdomsuddannelsesordfører christiansen så menneskelig for borst værdighed i båd som guld kim john dietrich er marlene mathias fra hald universitet jesper dragsbæk der arr
12,årligt emil nørresundby på bette og grise dyr slott minor i petersen henrik som en sørensen til er gris fra jesper der hos helle souschef
10,af dronninglund brønderslev nytte de på kan og den lære skal i har som en det at kommune øster til fra der ny lærer
23,af brønderslev bile hjørring på med catalonien og barcelona for aalborg om i har som morsø rebild det kommune jammerbugte til er thisted fra region der bil
22,af på barn kød med og spise for kødet eller i som mod en angribe angreb til er fra der stykke
23,af gunnlaugsson ved merkel vi over og dansk debat berlin cdu for domstol i skattely har konservative mod en kommune angela til er eu der
10,dronninglund brønderslev japansk mærke på et s med og df den brian i peter hammer v en det øster kommune sørensen til henning fra der de
23,af kniv på et talen med sortere og råd den for i har affald som mod en det dette europa til fra strasbourg eu smide
24,punkt guitar på f med og bas bedsted spille marianne for andersen punktere i vokal har hvor som en at klokkespilskoncert sin er fra mellem bedstede der
1,styrelse af al på og riad for el bliver i har ahmade som at blev ahmad til er ali fra flygtning
13,af grænse ved på over brite og dansk for om danmark i har kvindelandshold en at til er føre ud følge mellem men
26,af foran alle lægge københavn gammel på læge praktisere og for i som en rådhus sin til læg uddannelse der ny videregående
13,norge på et med og sverige to tyskland i båd skib som mod en helikopter skibe til er fra der
1,af ved bk på et nordsalling og fri da for i sætte som efter bokseren få til er fra tiltrække her flygtning valg de
13,af nielsen ammitzbøll nikolajsen emil på med og ungarn simon for jensen i skole petersen har vente anklage stenbygaard mod det til er fra de kenneth
7,se række seniorråd på et og production for om stille i hjemby har som petanque skovsgård det at anbefale til er fra hotel morse ny spørgsmål
1,af mere bk på nordsalling med og da for i øg sætte som video bokseren få til er fra tiltrække her der flygtning de overvågning
11,af op mariagerfjord stor et med og udvalg for om i teknisk har som ske rebild det kommune til er fra højhus
22,milliarder ved på et mande med og for unge om mand i millioner som mio spiller ung til menneske fra krone der valgmøde
2,af al på og riad årig for el bliver i har ahmade som noor tontowi fortælle blev ahmad ali til er syriske fra flygtning hjerneskadede fenar imod
18,liters på med og for aalborg motor i som en det kommune fisk til er fra universitet krone men der primus fiske
29,af alle ved politisk på med og flytning for i har som efter sænke en det skatte at skat til er fra men der parti
16,på mande med og df emoji den lund for unge om i poulsen som yussuf v en pape k filme ung til ib film fra der ninjago de
28,af svensk ved på over med og for om ikke i kat kime som journalist en limfjorden til er fra der hund
14,kirke på over og folkefarm siger motorvej for direktør ik i som administrere en egholm hobro til er adm forbindelse fra via men hos ny
4,af vrå vi på med og a løkke for skal højskole i farsø som kommune elevere til er fra udstilling der elev vandværk
2,af øre på med og emoji for om i som ør filme næse til er film fra men der ninjago flygtning pr
3,på et brande med praktisere og så brand bus buse eller i var som drive brovst efter lægehus falck til er fra men der tage
28,af på påsætte brande med og trailer stærk brand for stjæle eller i efter mod en angribe angreb fra alm der
22,af blive stor på aars barn med og årig enkelt bus for buse om i anbringe båd været lokale en at til er julehjælp nu de
10,kirke lægge forsamlingshus lille på et med og dansk terndrup vestergaard knuse asfalt for trine i har brøndum siem som peter at erhverv erhverve til st landsby sig ny
14,af julekalender vi wieghorst lem topskat på s østergaard betale med og siger cheftræne tv om jensen i bo som klarhed sænke en morten til lavere træne
21,af sårbare københavn nuværende barn s kan og overborgmester frank hjem for arbejdsmiljø eller syg i hus din krydse som jammerbugt en socialdemokrat arrangement er psykisk dit liv egen sygdom
27,missionshus kirke nielsen seniorråd med og siger for direktør myrtue i vibeke har farsø lei fortælle en anbefale til er gamst fra dag sygehus morse haaning der ny
26,af produktion ind sag vi på med og den for område flytte han i har stede pågældende en det at til er sig fra dag der de person
7,af på og for regionsråd i har var som blodprøve en have at blev stoppe få til er tage der nordjylland stop
15,af op klodset ved skovbakke på med og da hold idrætsklubben ik i straffespark mod tilløb tilbagelægning joensen er skovbak fra holde klodse der sit nordjylland straffe
17,nationalpark på og årig for to skole i johnny asbjørn u madsen som peter v en otto dreng hobro museum støtteforening til er fra der svend arr
12,forbruge gammel tredje et med kan og så for ifølge vejdirektorat testamente i forbruger har skrive som at til er fra tredie ny
9,af fritidstilbud på med bolig og den deres for skole i har lokale en iaks til afdeling god psykiatrisk ven ny
14,senegal hele over på offshore med og renewable den sverige dk gamesa formål i benytte ritzau har siemens skrive en sin tunesien er forklare underleverandør videre der kontrakt japan ny
10,af dronninglund brønderslev drifte samt på et med og ur stjæle drift i som det øster kommune til sig fra men smykke der
19,digital vrå instrumentering ved rasmussen på mogens sikkerhed og løkke for games gade i w v en ane til fra søren poste der lars infrastruktur bedtime
9,dronninglund sparekasse brønderslev frederikshavn teater ved på med og himmerland for i en det øster kommune til fra der golf
22,af ny på med og dansk årig for i har veteran hvor butik en sin til er familie der hel blandt
9,børnehøjde holdt frederikshavn formbyggeri samt på et aars og himmerland da pm for aalborg om skolebarn i øvrig som derfor hobro boligforening rejsegilde til løgstør mener men der
15,frøslev sparekasse ved på mollerup og årig olave forstander mølle jørgensen to i borgerforening u som peter en hans dreng jens olav til fra der guitarist nobelinstitutt
16,af vand rent hendes med og vandet df lund vande fare under eller i poulsen varmt far yussuf v en min fars pape k hans sin ib er fra kold der
29,af på mande med og for to mand i har som en at blev tyrkiet sin til er fra uddannelse der videregående
12,af hash mariagerfjord kilo på mande med og unge mand i gudstjeneste gram som ske rebild byråd kommune spiller ung til menneske fra sælge finde der
29,af ved hav på et over med og patient energy for i ribe mod have kommune odense til er fra der esbjerg
27,af kirke støvring ved spekter politisk på og årig for to i u som brede en det dreng er stubhus fra sæby arkitekt der grønborg
27,af tillæg mange på et arne mogens og siger lene for i har garantere som oprette en at opret blev thomas oplyse hans borgmester til er opretter der birgitte nr tillægge
