27,af kirke når ved motionisterne vi forvaltning på med og terndrup blenstrup den for om sofiendal skole i teknisk har velfærd bedre at kommune til er kaos fra sygehus eng
21,af udelukke nørrebro omkring ved på s med og fodbold næste pokal ikke i jylland union udelukkende hvor møde som det at bethania give til er fra dbue men der euforiserende ydre stof
4,af begge nordjysk tab på et over med og dansk så uagtsom deres pengeinstitut for skal om eller i foreningsliv som lokale det man at manddrab til forvolder komme hvis der tabe
8,af ved strækning hjørring på med og vendelbohus motorvej for om i indenrigsministerie har hvor som en det fremtid egholm oplyse til er fra mellem hel e
25,se vand vi gammel politikommissær jeg på være måtte og siger dahl salte katballe for sige dame jørn salt ikke i jensen jyllandsserie baandrup en det man have serie krest jens ud fra køkken division må hvis mørup
5,las måle martin kristensen over på et firma dam med og for private to per i har henrik pausestilling andrea som alling kim spanske til er fra mål dissing egen der nære mette la
5,formandspost onsdag vi stor de borgmestersædet på et carols s med og siger christma mord deres den beholder fartøj feriere i hvert butik efter ferie nordkoreanske typer en by er the momse men flatliners flyforsinkelse beholde jigsaw
2,al abdalla juul mistrati olsen og riad siger årig el jørgensen imod bliver jensen holm har ivers ahmade som noor tontowi fortælle toft danny blev ahmad sørensen biskop arbejdsmarkedsforsker kopplin ali henning syriske damborg hjerneskadede fenar mikkelsen
19,af is på og dansk ai den for om kunstig kunstfond total i islamisk skævvridning har hvor intelligens social en det hanstholm museum til er historie fra havne følge men havn der stat nok
11,af pct mange på over med og årig deres unge to alkohol i u som mod en at dreng til er menneske fra der gøre de indsigelse imod
28,af havde boldrup på også fund med og fri den for om ikke i jensen har ulv historiske som efter en have at blev museum sin til er men finde morse der position stat de
22,eventmager militærbase velling tyrkisk lindberg ved martin vi på med og a meget afhoppet for jon skal strande i vagthavende farsø restaurant en hans officer til er camping strand cyprioterne fra men mette vandværk
19,katolske af kirke brønderslev christensen ved på og hesselvang guldager hessel koncert sportsuge bertelsens i har korshær lystbådehavn hvor som regionshospital pape at k hans hobro jens ejne regionsrådsmedlem fra thisted dag hvalpsunde hvalpsund bertelse sognehus nykøbing næstformand randers hos nordjylland
18,af håndbold brønderslev frederikshavn ved energi stor på s med og a tapas den trænere eller m i morsø en det at forsyning lasse spiller fck til er musikalsk bal buffet flad flade kamp der
0,på mande med og dansk den virksomhed for unge eller i har mtb som en at tyrkiet morsingbo løb ung slippes til er fra spore der de
11,af hjul mariagerfjord hjulet på tomme limfjordsråd med og år for andersen to i har var fire din som borgerliste en kommune jens til kristendemokrat sammen fra integrationsråd hjule mener der
20,af ind ved før på med og spille for minut to om i ulv hvor efter rundkørsel en tanke at tank få til er fra fem der de
18,af sognepræst måde nielsen svennings på mande og borr siger årig mortensen den pandrup egholms andersen i kvinde som udkomme en asgere dreng elevere morsingbo til er fra jorn hørving elsebeth dissing bust der nu elev de tvenstrup
0,af formand vej nielsen stor på med og mare dorthe siger gerlach for om fortsætte i holm har som en europa at det hansen kommission læsø john græsborg til er tang fremgang anne eu der lars
20,af is bruge ryå ved pesticid nuværende på med og anvende for tunnel under i system har som en det at langs gennem sin til er fra arbejdsgiver der tilladt
29,af apostscriptum nordjyllandsværk på over bygge et med og a for aalborg to vestby eller selv i købe har hvor som at til er fra både der de byg procent
6,af thorbjørn foran nick før møller os og staude stjerneskærm sekundere gunhild den heinrich om eller ikke i olesen lade efter sekund en det høj man tilbage lader til er sig fra kranser birk der de la
13,middelalder wilbek af politi på med og dansk mortensen levende virksomhed andersen i ulrik har var mørk som en fc kommune håndboldlandstræner at hans til er kjær fra thisted men der lars
3,af fødevare smitte også på politi linde antorini med og dansk så undersøgelse for ifølge ikke i positiv har benner undervisningsminister hansen det at porsborg landbrug til er fra thisted anne hjort nordjylland christine
11,af kirke lunde larsen støvring på s med mariager og så for per skole i har var først jan v fjord at museum til er lauge fra kastrup der valgaften
24,af sårbare brix børs sen kær på uganda og dagblad lene for arbejdsmiljø mand flytte syg jensen i eller har indvier skrive som terror en politiken jens til er bjørn psykisk fra thisted information afrundede kjelgaard der kristelig sygdom
4,af håndbold kirke sag arbejde ved gammel over på med mariager og år den for herberg strikkeklub i har korshær mod en det genbrugsbutik kommune fjord tarm arr skjern til ringkøbing fra de
10,af timelange arbejde støvring mange på aars barn med og frivilligt ko dansk for frivillig lange i som kø en det senior til er der tage de
21,land af havde bagfra stor på et f og com for ifølge påkøre mand han ikke i har cup som en hanstholm det blev uefa lukke asylcenter til fra bilist fodboldforbund fagforening der de
7,alt dronninglund brønderslev vi på med kan og spille den om eller han i som efter en det at kommune øster fremme spiller sin til spile spil fra borger fratræde der brevstemme
17,af bøge på med og dansk midtmorse år støberigård for bog om fodslaw i julefrokost lystbådehavn som efter nibe morsø en boge elevere til er løgstør fra bio der nykøbing elev
23,af is forening op stor på over ned norden og gravet gravere all mand dybt eller n i var som promille en høj eg grave til er sig ise grav graver stat forbudt hel
24,wilbek mere af dronninglund jeg et over friplejehjem kan og permanent mortensen den andersen flytte han i mig ulrik undren undre en det at asaa håndboldlandstræner hans til er kjær sig fra havne tirsdag havn permanente gøre lars
9,af vej frederikshavn boligselskab altan thomsen stor på aars thagaard med og himmerland vestergaard så den vester pm ukrudtsbrænder aalborg ulrich i som bryghusets en boligforening til er løgstør mener albrechtsen der lars ny gyrithe smide gavl
21,kirke vej støvring ved københavn s synes og siger løkke kystsikring allan zoo udvalg for daniel aalborg bliver i billede viceborgmester brunch lildstrand som en karsten det til er stubhus fårup fra denne
13,af op wieghorst på ned s bestyrelsesformand med og dahl så gravet gravere sårbar da hold sige dybt dahlåbningstale i thulesen har henrik mangle en dahls kristian morten grave er sig holde fra september grav men graver der aab
18,københavn stor norge på if og sverige for fremskridt danmark thy i har brøndby tilstrækkelig som mod agf nordsjælland fc mor stilling hf til er fra morse bio nykøbing gøre de
10,af anette steen mariagerfjord på mande med og cykling for to mand i var som lotte v kommune blev kilometer lasse til er fra enggårdsgade integrationsråd men munch business riisgaard der løbe stof
3,af sat santande spanien på med og råd for minut om tyskland danmark i råde cup federico frankrig lyder at divisionens tilbage til er fra division præsident kunst italien
1,styrelse af teater på og himmerland siger for aalborg jørgensen thy i jensen holm har ivers som morsø at toft sørensen biskop arbejdsmarkedsforsker til er henning fra vendsyssel kongelig flygtning
4,af munk ved københavn mariagerfjord vi på ansgarskirke med og siger kaj kirk for skole i var kaje det fc kommune en mogensen til er vil fra integrationsråd universitet men daginstitution ny
19,emmanuel bøge donald recep anden på s med og årig for burde bog to om i u date som frankrig efter en det at boge dreng amerikansk til er noget fra der nu præsident vladimir
25,af holdt fødevare drikke på et med og dansk spille borgermøde for øl om i hvor som sodavand kaffe en landbrug til er spile spil fra
7,af frederikshavn live på med og patient syrien for forebyggelse om i en det at kommune sanaa genne til er fra der yem
5,styrelse af brønderslev nielsen kvalitet hjørring på og for aalborg i har ole som v morsø rebild at høj kommune french jammerbugte til er fra thisted god men der
3,af merkel tysk hjørring på og enkelt deres for pårørende om tyskland fortæller hadsunde i skagen har som mangle en det kurset kansler hun lav angela til er samtidig bryde selvværd køre helmut der sit de spritkørsel
13,eventmager af velling lindberg martin med eugenio og indehave julemad for jon i traditionel vagthavende har kime grundlægger nogle en hans grundlægge give sin til er familie fra rigtig søren jeff god der hel mette
3,af mere sag ved gammel på et og fri så skade meget den kort om lange i første alvorlig efter en det at til er alvorligt tage skoledag valg sygdom
15,lee på med og årig emoji for to om især i weinstein oswald har u som en at filme dreng filmproducer morsingbo filmproducenten harvey til er film fra orkan der ninjago
26,styrelse medarbejder af flere mange dalgaard ansøge et dunhill med josefsen og turneringen beton for dahlgaard om i alfrede banen har kultur som ansøger at få til er fra klima miljø der frederiksen infrastruktur
28,tobiasen sognepræst måde onsdag stregspiller ved på bolig og årig bukh ringe for stjæle to skattelettelse i u eksistenser jerslev pige en det skæv skovsgaard kønsfordeling vinkle kathrine staghøj fra skæve heindahl der
10,af dronninglund brønderslev arbejde mange plejehjemsplads på og frivilligt cykling for frivillig i som en det øster kommune kilometer lukke kommunale til er fra men der de løbe
3,af lød larsen ved koordinator østerbye stor kristensen med christiansen lyde legarth laursen hurtig paul private uden indenrigsminister om jong kime var udrykning bringe melding lyder en zinke sjøgren hansen det metcaflfe danson kim få wall er til fra ryan grytebust der
21,af kirke vej nørrebro selskab omkring ved på synes med og dansk løkke kystsikring udvalg for domstol i brunch lildstrand hvor møde har som en at bethania til fra eu der ydre
10,dronninglund brønderslev ture blive på et med og tur gå område utrolig om i været udlægge som en det at kommune øster blev til er komme guidet historie fra god der tage går
7,udsat af miste mere arbejde stor på socialt og dansk bedrageri årig netværke den for to i fuld har skævt båd u social som mangle en have blev tillid dreng til er fra ansvar liv samvær der jøde kristne
2,af mere ved mixeddouble slutspilspladserne bygge på over med og dansk emoji for om nydannede i øg svendsen video som en toft filme til film mathias søren mellem bro der ninjago ny overvågning
26,af emil på et søn og årig bestille to om slott minor g i petersen henrik som en min det lav topmøde sin til er føre sandwich fra årlig jesper mellem eu der lække
14,foran brønderslev fuglsang blåbjerge rinne juli ved vi hjørring på nørkle og hjorth siger støberigård aalborg oktober i har åben som pony morsø rebild en victoria ubrugte kommune okor banko mandag jammerbugte kortbæk film thisted the jakob pedersen ahlmann little virkelyst
29,kirke foran larsen kirsten vi tradition på fs jeg og simon fodbold for ik ikke i han jensen var carsten birthe vestthy en det at hobro museum til føre tro kjær fra der de
10,af fortuna plejehjemsplads hjørring på aars et med og dansk støberigård for sundhedshus i første har en det at kommune arr hobro erhverv lukke kommunale til er erhverve danseaften sig fra der de
28,af svin på et med og dansk lyde trailer profeten for stjæle ifølge brev eller i tegning var åben som en at væk sende til fra svine der muhammed mrsa
7,af prinse på sverre og siger harry prins for stikke skagen i stikker har ældreråd henrik en det at joachim advokat hans forsvarer stak til er fra william stuk charles stik der ny
8,af masse ny anden på et med og den for under om han i mod jeppe tinge en penge at det v hansen ugil thomas erik tog retssag gode til er sig fra massere tage der hel imod
12,af pct novo nørresundby på med og nordisk råd år for under om eller alkohol i kulturmøde som det filme sørensen til er samarbejde fra morse hos helle ny fond souschef
3,ved vi lille samfund på et og international dansk sundhedsvæsen for lave hastighed i hvor som agf en det høj fc kommune til er fra randers nære
9,af illegale professor frederikshavn indvandrer flere stor på aars med og himmerland hæder den pm for aalborg skal i benytte vestlig som en pris boligforening til fornem løgstør fra mener lejlighed der medalje
8,af sårbare ved mariagerfjord samt på kan og lodtrækning toilet for arbejdsmiljø uden om eller syg i gudstjeneste playoff ske efter rebild byråd en at kommune det til er psykisk fra toilette sygdom fredag
17,kirke dronninglund brønderslev sparekasse teater ved på med og himmerland år svømmehal for julefrokost i ravnkilde en det øster kommune serie brorstrup til fra durup dag der golf
12,af pct flere mange på ansøge os med og år for område under om eller alkohol i kulturmøde ø ansøger det at få til er vil markedsføre sig morse der de
26,thrane af kirke på med mariager og laursen for el phillipsen jensen i skole weisbjerg multihal fører brovst en fjord at tilsyn margrethe museum plejebolig philips skærpe til er føre fra men der de trane ellen
23,l af frederikshavn britisk på lækage herlev med liga og grundspil fastslå p så da den aalborg under eller i hel en det avis premierminister til exit er kælder fra bbc herning fven de medie
1,styrelse af klosterkirke på med og emoji for om i har som at filme til er film fra børglum der ninjago flygtning kloster bispen
17,mere lægge på med og dansk midtmorse så dispensation knuse støberigård asfalt for forurener søge om fodslaw ikke i mest lystbådehavn som nibe morsø en det at give få til er løgstør fra forurene bio nykøbing ny
11,af stemt de hjerl på barn og oprindelig dansk voks debat hedde hede for voksen aalborg hed i har stemmer stemme som handest en det at byråd til er kamp ny
6,af kirke de på og ungarn for om ik skagen i har vente ulv ældreråd efter mod en det at hobro til er fra der ny
15,af sen på et over politi med og årig deres sine næste ifølge under to i har første u som en parre at dreng til forælder fra thisted der par sidste nordjylland
6,af søndergaard mange vi med og siger så meget vester forfatte for ikke i forfatter public norske offentlig som peter en det k amerikansk til er lige kende god duedahl justese kulturrådmand der service de mads
14,af klar christensen larsen nielsen jørgen ved stor på et med og ko forbedring for ken brev fortæller i var åben som ravn kø en kaare sende til lang fra søren kurt der
24,af brønderslev ture majbritt enevolds hash hjørring på et med og isabel tur støberigård for aalborg i robert har gram sebastian morsø rebild rundt kommune kringelhøj kristian schjoldager amfetamin jammerbugte til km ud kokain thisted finde bio der lars
