23937,en til uddannelse og på af som sin for i videregående
14076,køre hadsunde om og på hjørring for spritkørsel samtidig skagen
1828,kirsten jakob jor jannik pallesen der kaspe kristof aab per rasmus
6802,stilling til er der jeg han som tiltræde januar i at
26893,fra kommune til universitet og på aalborg det for i
2891,årig marie barn og diana dianas ingrid prinsesse estelle at
30908,en til minde og der ved efter gudstjeneste med i
26746,fra en til og på kirke for ik hobro i
27557,randers silkeborg lyngby brøndby og agf fc aab x mod
3671,sjøgren larsen kristensen legarth kim kime østerbye christiansen jong hansen wall
12047,christian lars rii minde der kristian allan søren ole andersen johan
28534,et modeshow på ældrecenter onsdag administrationsbygningen holder stor med teglgårdsminde i
11241,en stærk personlighed og der farverig stor som med i smittende
8090,men til og på kriger my ise det is med i
15010,et dansk og var da stor for drama med i
1849,en god og på gøre reklamere reklame for falsk i lide
563,efterfølgende dk nordjylland thy studievalg vigtig vil har vejleder kontakte unges
3807,og af ankomme på møde kom som komme julemand at
4755,koncertere til to klassiske og af fire tre koncert mange med
18638,umiddelbar selvmord begår forsøge begå om og er skal dø politisk
9810,et til de og der af eller våben som med i
4774,fra er og brovst på ved fjerritslev for gymnasie i
27312,revy når er og teater hjørring diskotek revyernes med i
1969,hændelse hvilken i om af og barn opdragelse eller både skolegang
16392,hvor til hanstholm havn er og på havne for har i
4730,men til og på under det lønne for som i løn
5645,en til og system gps indbygge udstyre har med via
24570,hilden frederiksen sloth er og jytte nielsen wester museumsleder andersen høyrup
5460,debatindlæg fra til om og er skriver som debatindlægge i at
26919,ståle på solbakke plejehjemme plejecenter solbak league plejehjem
10588,fra siger lundeng jensby er og møller jensen flydtkjær susanne sangill
18093,musik et til hus i hvide og hu fuld åben huse
30546,meget en sygdom så et er skade tage alvorligt alvorlig mere
8478,pm himmerland aars og mener boligforening frederikshavn aalborg løgstør som
21092,disponere deres kan og eller over for kunne penge fritte at
5184,vito amankwah bj der minut mathias nicholas yaw hobro rasmus ihle
4116,morten gjøl og på der halkær det kro i suldrup
16205,s tidligere er og lyngby ob fc aab i mod
27282,et er frit og får få sig helt fritte mere
54,en garage fra med og på eller det for i
3381,en til e og midtmor det for tv i sport
5132,en bruge bruger den er under der betegnelse farveblindhed for international
6456,god om og af flaske lions rom som med whisky
26924,fra to er og mande der på blev som mand i
8049,fra næse en til hals og på ved gal i halse
26071,en brede og der samarbejde bred sig politisk flertal i udvalg
20676,men vækst er og på der som det for vækste i
5964,lund kjær minister fortælle og af hanefelt miljøminister oddershede fødevareminister esben
17375,meget en hilsen hilsener den og under kærlig behandling hånd tanke
8334,en fra til robot og af kan som med i
23754,kop købe til og på der kaffe te eller med i
31882,lintrup siger bodholdt sørensen fortælle larsen oplyse og kilde anja birch
23562,en blive et den er de tildele blev få har at
8637,fra thomas christian thor og frederik kortegaard minut jensen ren
30876,en til god offentlig og der service public for som i
10380,morse fra nykøbing til bio og på mor thy hf
9445,blive den er og af blev dræbe dræber have i at
21263,område hvor et er og på der det som for i
17001,tor en guldbrandsen to bagger skolevej efter jeg nørretranders musikbrevkassen rild
9125,indien fra malaysia indonesien saudi er og på kina vietnam i
4372,bold nicolai og lindgrene der lindgren få for glæde martin i
17268,deres af på og første sidste for sin med i optræden
30437,en til og på hund eller som sin med i
17395,michael fra s mølle og der nicolas erik har mortensen bugge
28211,fra kommune til teknisk og af om forvaltning har i at
20758,arena banket og der bank jutlande som har banke for i
21562,stak stakke stikke
11524,universitet københavn aarhus og der aalborg han det har i syddansk
23385,en til uddannelse og på af som sin for i videregående
15880,boge til om og på efter er bog bøge med i
19383,american sick teaterbio borg made ind first assassin tale i morgen
14820,til om og på for dans danse som med i
29840,oktober på støberigård virkelyst mandag banko vi åben juli i nørkle
11132,benytte en lejlighed til den og på der flere med i
28021,fra jørgensen bruun nicolai og der henrik henning som per v
20550,vadefugle måge de og på kan af er sjælden skyde stor
22085,en fra og der på af varebil som hvid med i
23817,en fra hvor aston og på frederikshavn villa bælum i
10383,beskæftigelsesminister lund lyby organist malling kløve og troels odgaard laursen kold
31615,en fast base og på camp for har som med i
